In pictures: Balonne River running on empty,http://www.abc.net.au/local/photos/2014/01/29/3934276.htm,29/01/2014,http://www.abc.net.au/reslib/201401/r1230271_16213306.jpg,"Di Pain walks along The Terrace at St George, on the banks of the Balonne River, each morning. It's the place fisherman often sit with a line at the water's edge. ""It's not very good,"" she says. ""You can actually stand in the middle of the river right now.""",Copyright: Audience submitted | Source: used with permission | Byline: Di Pain,"Disasters and Accidents:Drought,",ABC Southern Queensland,QLD,St George,"balonne river, drought, st george, levy, dried up",-28.0333,148.5667,http://www.abc.net.au/local/photos/2014/01/29/3934276-mediarss.xml, Talk to locals and they'll tell you it the worst they've ever seen She says the town relies on bore water for drinking supplies but it has had to increase water restrictions to protect what is left in the river There certainly is no water that can come down from Beardmore Dam down into the Jack Taylor weir where we source our urban supply she said They tried to do that about 10 days ago and weren't successful so there nothing further available to the town out of the dam Ironically reminders of what the river is capable of aren't too far away At the moment we've got workers building the flood levy bank in town local photographer Di Pain said It bizarre Locals are still hopeful for rain We got 30-odd millimetres of rain the other night Ms Pain said Even though it wasn't anywhere enough near enough to break the drought or fill the dams it did make everyone quite happy,"images/0933.png"
Charters Towers Goldfield Ashes 2014,http://www.abc.net.au/local/photos/2014/01/28/3933506.htm,28/01/2014,http://www.abc.net.au/reslib/201401/r1229791_16202856.jpg,"3000 players (and their entourages) converged on Charters Towers for the Australia Day long weekend. Charters Towers mayor Frank Beveridge says the event is a well needed diversion from the drought. 'We have a lot of teams that are built of graziers from the area and it's a good reason for them to get together,' he said.",Copyright: ABC | Source: ABC | Byline: Michael Bromage,"Sport:Cricket, Sport:Cricket:Ashes,",ABC North Qld,QLD,Charters Towers,"Charters Towers, Goldfield, Ashes, 2014, ABC, Australia, sport, news, drought,",-20.0739,146.261,http://www.abc.net.au/local/photos/2014/01/28/3933506-mediarss.xml, It the one weekend of the year that Charters Towers doesn't mind a few extra bats The 2014 Goldfield Ashes saw 228 teams take to more than 70 fields around town for the largest amateur cricket competition in the southern hemisphere Get the results of the weekend matches on the Goldfield Ashes website  Find out why one ashes team went in to bat for mental health this year,"images/0940.png"
"Gympie: Flood levee out, drought declaration in",http://www.abc.net.au/local/photos/2014/01/23/3930726.htm,23/01/2014,http://www.abc.net.au/reslib/201303/r1083141_12896719.jpg,Deep Water creek and the Mary River join as floodwaters leave mud and silt behind after flooding in 2013.,Copyright: ABC | Source: ABC Multiplatform | Byline: Jessica Hinchliffe,"Business, Economics and Finance, Government and Politics, Government and Politics:Local Government, Rural",ABC Sunshine & Cooloola Coasts Qld,QLD,Gympie,"flood, Gympie, drought, levy, farmers, council, Sunshine Coast, abc",-25.8907,152.7571,http://www.abc.net.au/local/photos/2014/01/23/3930726-mediarss.xml, Estimates for the flood levee project exceed $34 million Gympie mayor Ron Dyne says the cost is too much for the region What behind the recommendation is the sheer cost of what is proposed he said We initially had indication that it was going to cost $227 million and people could live with that yet there were others in the region who said they couldn't All of a sudden when you start designing and so forth and with the number of fail safe systems required the cost has increased to $344 million and it could come out a little bit further Councillor Dyne says he will recommend that council doesn't proceed That amount is out of our budgetary considerations therefore at the council meeting next Wednesday I will lobby against it Future plans </strong> With the region looking for options the mayor hopes the pre-design stage will help secure funding What we needed to do was to prove that the levee could be constructed and we've gone to the pre-design stage which indicates one can be created Councillor Dyne says it disappointing for him to make such a decision I'm extremely disappointed that all through my life I've been taught that when you see a problem that you try and fix it he said I can remember standing down there four times in one year and two times in one month and seeing that water come under the highway and inundate the CBD The mayor isn't confident that other governments can help When we went into this we said $227 million was our limit; if we can now have discussions with Commonwealth and State Government we will From floods to drought </strong> As the town looks to dismissing a flood levee warm weather has lead to drought conditions in region Councillor Dyne says farmers are hurting to the west of the Mary River It dry out there and I was approached by farmers late last night and I've had discussions with my councillors he said We will approach the State Government to look at getting a drought declaration and that will mean they can then claim on the ability to take cattle out of the area or bringing fodder in They are all doing it tough it quite amazing that this time last year we were in the depths of an awful downpour and now we're so dry we have farmers outlaying money for fodder and supplements,"images/0951.png"
Sprinkler ban for Longreach,http://www.abc.net.au/local/photos/2014/01/20/3928380.htm,20/01/2014,http://www.abc.net.au/reslib/201401/r1225969_16114874.jpg,"Bill and Faye Parker watering their garden in Longreach, central-west Queensland. From January 20, all sprinkler use is banned in the town, while hand-held hoses will only be allowed for two hours a day.",Copyright: ABC | Source: ABC | Byline: Blythe Moore,"Disasters and Accidents:Drought, Environment:Water Management,",ABC Western Queensland,QLD,Longreach,"water restrictions, sprinkler, hoses, hand held hose, garden, water saving device, thomson river, water supply, drought, ilfracombe, yaraka, isisford, longreach regional council, blackall tambo shire council, diamantina shire council, winton shire council, murweh shire council, charleville, blythe moore, abc western queensland, danny kennedy, kate stephens, news",-23.6445,144.2475,http://www.abc.net.au/local/photos/2014/01/20/3928380-mediarss.xml, Lush green lawns will turn to brown in the western Queensland town of Longreach in coming days as the local council enacts tough new water restrictions Hand-held garden hoses can be used for one hour in the morning and one hour in the evening Garden enthusiasts Bill and Faye Parker say they understand council decision to enforce tougher restrictions I don't think they've got any option Mrs Parker said We haven't got the amount of water so we're just going to have to try to keep a little bit of the lawn alive and wait until it rains Mrs Parker says gardens around the home are like an oasis in the drought You can relax in that area and it not as depressing as when you look out the area and everything brown Mr Parker president of the Longreach Garden Club says he expects some gardeners in town will be disappointed with the restrictions But we have to go that way even though we all know (the river) is going to be running in a month time there that small chance that it may not he said So we have to take those precautions and be well prepared Desperate measures Longreach Mayor Joe Owens says if the town needs to cart water it will be difficult and expensive He says the community needs to play its part in reducing water consumption I just hope that we never have to get to that stage but yes it has been looked at and I suppose you can say we are ready to act if and when the time arrives he said But that is a little bit down the track at this stage and we hope that people do cut back on their water usage and therefore prolonging our supply and not having to resort to carting Water restrictions around western Queensland Blackall-Tambo Shire Sprinklers can be used between 4pm and 10pm Monday to Friday Sprinklers can be used at any time on weekends In Tambo even street numbers can water on Monday Wednesday Friday and Sunday Odd street numbers can water on Tuesday Thursday Saturday and Sunday Murweh Shire Only handheld hoses can be used between between 11am and 3pm daily No water restrictions the remainder of the time Barcoo Shire Council Handheld hoses can be used at any time for domestic use Garden drippers and other water saving devises can be used at any time Sprinklers may be used between 4pm and 8am for residential propertiesWatering may take place in public properties at discretion of council at any time Winton Shire Council and the Diamantina Shire Council No water restrictions,"images/0960.png"
You can lead a budgie to water,http://www.abc.net.au/local/photos/2014/01/14/3925495.htm,14/01/2014,http://www.abc.net.au/reslib/201401/r1224523_16080195.jpg,A sea of green feathers on a small patch of grass 100 kilometres east of Boulia. Boulia mayor Rick Britton says it's usual to see many budgies after a good wet season. He says he is hoping they know something he doesn't.,Copyright: ABC | Source: Contributed | Byline: Ann Britton,"Disasters and Accidents:Drought, Human Interest:Animals,",ABC Western Queensland,QLD,Boulia,"budgerigars, budgies, birds, galah, brolga, australian birds, outback queensland, drought, pictures, photos, photography, wildlife, ann britton, rick britton, boulia, abc western queensland, abc north west queensland, blythe moore, kate stephens, news",-23.1154,139.7058,http://www.abc.net.au/local/photos/2014/01/14/3925495-mediarss.xml, Thousands of budgies have congregated on a remote outback Queensland property Western Queensland grazier Rick Britton says the small green birds are a sign of good rain to come Wherever you looked on the horizon you could witness moving black clouds she says The knowledge that these tiny green flocks of birds are creating these clouds while moving between feeding spots on the ground makes me question where did they come from?,"images/0977.png"
ﾑBloody desperateﾒ,http://www.abc.net.au/local/photos/2014/01/07/3921968.htm,7/01/2014,http://www.abc.net.au/reslib/201401/r1222191_16027102.jpg,Mick and Tess Pemble on their Homestead property west of Charters Towers. The couple have already lost 500 animals to the drought.,Copyright: ABC | Source: ABC | Byline: Allyson Horn,"Disasters and Accidents:Drought, Rural:Livestock:Beef Cattle,",ABC North Qld,QLD,Homestead,"Australia, ABC, drought, Hughenden, Homestead, Pemble, Queensland, assistance,",-20.35,145.65,http://www.abc.net.au/local/photos/2014/01/07/3921968-mediarss.xml, North Queensland graziers are calling for politicians to walk a mile in their shoes euthanising stock daily and watching their livelihood shrivel under drought It is definitely the worst I have ever seen it I have been in this district since 1970 says Mick The Pembles are spending in excess of $35000 a month on lick but 500 animals have already starved to death and Mick says government help is hard to get (It) bloody desperate I would really really like to get the leaders of our governments to come here and stand here with me help me day by day drag either dead cattle out of the watering point or a live one that won't stand up and I will give them the revolver and tell them that they have to do my job he says Mick feels let down by the government and says restrictions on the industry coupled with the drought may end the beef industry in Queensland We have got to supply to the world market (and) they dictate the price to us but our government sets in policies that we have to pay Australian price for every input that we put in If I could source all of my products on the world market without government charges this industry would still be doing alright he says More than 60 per cent of Queensland has been drought declared Under the Queensland Goverment Drought Relief Assistance Scheme (DRAS) farmers can apply for subsidies including freight subsidies of up to 50 per cent on fodder and water The Queensland Government will provide up to $20000 to drought-declared producers under DRAS each financial year,"images/0991.png"
"Fire, drought and flood shape the Hunter's 2013",http://www.abc.net.au/local/photos/2013/11/15/3891936.htm,15/11/2013,http://www.abc.net.au/reslib/201310/r1190578_15313068.jpg,Burnt-out bush left behind by the fierce fires south of Lake Macquarie.,Copyright: ABC | Source: ABC Local | Byline: Susan Steens,"Arts and Entertainment, Disasters and Accidents, Disasters and Accidents:Drought, Disasters and Accidents:Fires",ABC Newcastle NSW,NSW,Newcastle,2013 year that was in review hunter bushfires floods rain drought storms surfest art gallery black totem surfest show boston bombing portrait prize challenge cup exhumed NRL 1233 abc,-32.5298,152.2828,http://www.abc.net.au/local/photos/2013/11/15/3891936-mediarss.xml, Nature dealt Newcastle and the Hunter some crushing blows during 2013 as we veered from the extremes of torrential rain and floods to a lengthy drought which culminated in raging fires in every corner of our region Station manager Phil Ashley-Brown and operations manager Geoff Overmyer had the rare opportunity to travel to Casey Station as part of the Australian Antarctic Division media program which takes only a small number of journalists each year The pair spent three weeks on their trip bringing the sights and sounds of life on an Antarctic base to ABC Local Radio listeners as well as our online audience In February</strong> we got back to a more conventional Aussie summer activity when some of the world best surfers converged on Newcastle for Surfest But the weather didn't play along and conditions were so wild at Merewether Beach with 3m storm surf that organisers had to temporarily relocate the event to a semi-protected location inside Newcastle Harbour Reigning world champion Joel Parkinson took out the men event with Dimity Stoyle winning the women contest The wet and wild conditions continued into March</strong> when the rain arrived right on cue to wash out the Newcastle Show It become a local joke and a tradition going back to 1955 when the historic Maitland flood occurred during the Newcastle Show This year was no different and heavy falls caused the cancellation of some events More torrential rain soon afterwards caused flooding in parts of the lower Hunter isolating the township of Hinton when river levels rose Children got to stay home from school and SES volunteers delivered hay to stranded livestock but for locals used to regular flooding it was little more than a nuisance In April</strong> a number of Newcastle athletes including wheelchair racer Kurt Fearnley witnessed international terrorism at first hand They were in Boston to compete in the city marathon when the race was bombed with three people killed and more than 100 injured in the two almost simultaneous explosions at the finish line In May</strong> Newcastle was at the centre of one of the biggest scandals to rock the Australian racing industry Retired jockey and now Newcastle councillor Allan Robinson as well as Knights legend Andrew Johns were in the midst of a feud between the Waterhouse family and racehorse owner John Singleton The dispute over treatment given to the mare More Joyous ended with Singleton sacking Gai Waterhouse as his trainer and both having to appear before a stewards inquiry On a lighter note 1233 sent our listeners back to the 1980s when we held our Back to Blue Light event at Maitland Bowling Club A packed house danced to the hits of the decade that taste forgot dressed to the nines in the best (and worst) of 80s fashion The second running of the 1233 Portrait Prize had the station inundated with entries with the winner unveiled in June</strong> at an exhibition and live broadcast at Lake Macquarie Art Gallery The prize was won by Shane Blue with his moody shot of local artist Brett McMahon Also in June the State Budget revealed that the Port of Newcastle would be sold off to fund among other things light rail for the CBD It was described as the first time in living memory Newcastle was at the heart of the State Budget Meanwhile after all the controversy about the removal of the Laman St fig trees work continued on revamping the street with a new batch of figs ABC Newcastle again ran our 1233 Challenge Cup in 2013 this time focusing on rugby league and giving junior teams the chance to have one of their games called by a professional commentary team and broadcast live on the radio The ultimate winners this year at the game held in July</strong> were the under-13 East Maitland Griffins In August</strong> the ABC uncovered some previously well-hidden talent with our Exhumed competition It was a band contest for those who played for the fun of it not has-beens or wannabes but those who never were The local winners were heavy rockers Motherlode who along with other finalists played a live concert at Hexham Bowling Club Meanwhile the Hunter was in full election mode as the Federal Election campaign rolled on A last-minute leadership change saw Julia Gillard shunted aside for a Kevin Rudd return but it wasn't enough to avert a big defeat for Labor on polling day in September</strong> The ALP saw some of its big margins eroded in the Hunter but managed to hang on to all the local seats with the exception of Paterson On the footy field fans hopes were raised when the Newcastle Knights under Wayne Bennett managed to make it into their first preliminary final in 12 years But their late run came to a stop against a strong Roosters side which went on to take out the NRL Premiership The end of the team season was made even more painful when captain Danny Buderus playing his last game was knocked unconscious As October</strong> blew in with hot westerly winds and a long dry spell continued concerns for a bad bushfire season proved all too accurate sooner than anyone expected On the weekend of October 12-13 several big bushfires broke out in Port Stephens with several properties lost at Salt Ash and flames coming dangerously close to homes at Fingal Bay But worse was to come The following week while locals were still assessing damage and arguments were raging about a lack of back-burning the weather again produced ideal fire conditions Fires again flared up in Port Stephens this time around Heatherbrae and coming so close to Newcastle Airport it had to be closed Big blazes were also out of control in rugged parts of the Upper Hunter and a fire that had started at Doyalson North began racing towards communities on the southern end of Lake Macquarie There were hurried evacuations and the Pacific Highway was closed but Catherine Hill Bay was hit hard with the loss of a number of buildings including historic properties such as Wallarah House Still reeling from the worst bushfires the region had ever experienced the following week again brought outbreaks in the Stockrington area near the M1 motorway and at Gateshead which soon posed a threat to the beachside suburbs of Redhead and Dudley There were more evacuations and traffic chaos until exhausted fire crews brought the fires under control this time with no property loss Residents throughout the region were grateful to the firefighters who battled huge blazes in atrocious conditions but saddened that some of the fires were apparently deliberately lit by children and teenagers There was better news for the city when an enormous and valuable sculpture by Brett Whitely was donated to Newcastle Art Gallery by his widow Wendy Black Totem II is a giant egg in a nest and has taken pride of place outside the gallery which has had a difficult year with funding for a planned expansion falling through and changes to the role of the gallery director The migrating whales making their way down the coast weren't bothered by the topsy-turvy weather and put on a show off the coast of Newcastle and Port Stephens Temperatures dropped as the Hunter celebrated Melbourne Cup Day and by the middle of November </strong>the region was copping a drenching with storms flash-flooding and the heaviest rain we'd seen in months While the big wet caused some inconvenience to city commuters farmers further up the valley were ecstatic that the undeclared but very real drought had finally broken As we head into December </strong>and the summer holiday season most of us will be hoping for some thoroughly unremarkable boring weather rather than the extremes we experienced during 2013,"images/1000.png"
Rain and rejuvenation,http://www.abc.net.au/local/photos/2013/12/03/3904062.htm,3/12/2013,http://www.abc.net.au/reslib/201312/r1210604_15761913.jpg,"Ed Bird took this picture on November 29 north of Cloncurry. ﾓWhile it may not look like much, this sprout of green grass means so much to so many in Queensland. This growth spurt, triggered by one of a number of storms around the north west gives hope to families. A small sign that the last 12 months of struggling have been worth all the heartache.ﾔ",Copyright: ABC | Source: Contributed | Byline: Ed Bird,"Disasters and Accidents:Drought, Environment:Water, Weather:Rainfall,",ABC North West Qld,QLD,Mount Isa,"drought, rainfall, rain, storm, storms, outback queensland, drought breaking rain, pictures, photo, photos, images, photograph, photographs, abc north west queensland, abc western queensland, mount isa, yaraka, cloncurry, boulia, longreach, stonehenge, angus emmott, karen emmott, ann britton, ed bird, anne-maree lloyd, goodwood station, noonbah station, blythe moore",-20.3287,139.0897,http://www.abc.net.au/local/photos/2013/12/03/3904062-mediarss.xml, Sprouts of green are starting to appear in parts of drought-stricken outback Queensland following a series of storms across the region Mount Isa officially received 18 millimetres but there are unofficial reports of 90 millimetres at Happy Valley and 70 millimetres at Breakaway Estate Mount Isa Mayor Tony McGrady says more rain is needed but the falls have boosted spirits More from ABC News,"images/1066.png"
Wet and wild at historic outback Queensland fire trials,http://www.abc.net.au/local/photos/2013/11/27/3899887.htm,27/11/2013,http://www.abc.net.au/reslib/201311/r1207850_15700428.JPG,Itﾒs a tradition for local children to run into the street for a big hose-down during the last event of the night. Fire brigade captain Alan Dickson has taken part in 38 fire trials and says itﾒs been years since he has seen this many children in the street.,Copyright: ABC | Source: ABC | Byline: Blythe Moore,"Disasters and Accidents:Fires, Human Interest:People,",ABC Western Queensland,QLD,Longreach,"longreach fire trials, fire brigade, vintage fire truck, water, drought, bushfire, emergency season, blythe moore, abc western queensland, Randal Ravenscroft, alan dickson",-23.3445,144.0475,http://www.abc.net.au/local/photos/2013/11/27/3899887-mediarss.xml, Hundreds of people have spilled into the main street of Longreach for the town historic fire trials The annual event which has run for nearly 90 years is always held over two nights in the last week of November Local firefighters go up against each other and race against the clock in a series of wet and dry events to prove who is the best and fastest firefighter in town,"images/1087.png"
