Torrens Creek open despite the drought,http://www.abc.net.au/local/photos/2014/09/02/4079216.htm,2/09/2014,http://www.abc.net.au/reslib/201409/r1324101_18363220.jpg,The open provides a social focus for the community and a golfing challenge for competitors says the Torrens Creek Golf Club's Ian Hanaghan,Copyright: ABC | Source: ABC | Byline: Nathalie Fernbach,"Community and Society, Disasters and Accidents:Drought, Rural, Sport:Golf",ABC North Qld,QLD,Torrens Creek,"Australia, ABC, news, drought, Torrens Creek, golf, sport, open, outback, Queensland, north west, course, event, community,",-20.7667,145.0167,http://www.abc.net.au/local/photos/2014/09/02/4079216-mediarss.xml, There is no grass on the greens but organisers of the Torrens Creek Open golf tournament are preparing for their biggest field yet People are still quite happy to come and play golf said Torrens Creek Golf Club secretary Ian Hanaghan Of course it is a pretty dry and dusty place the golf course there is still grass on the fairways but it is all pretty brown The event has been running for more than 15 years and has become a focus for the remote township which has a population of 18 people It is a community thing even though I don't play I still like my sport and we can all get together and talk about things said Ian Despite the social atmosphere of the open the course is considered the tightest in north-west Queensland and Ian says it provides a challenge even for experienced golfers It is a challenge to them to not have to go wandering through the scrub to find a lost golf ball he said This year the Torrens Creek Open will be played on September 6 and 7,"images/0350.png"
Ping pong your cares away,http://www.abc.net.au/local/photos/2014/08/14/4066999.htm,14/08/2014,http://www.abc.net.au/reslib/201408/r1316205_18164784.jpg,"""Take a break for a couple of hours and have a hit,"" said Kim Bremner, farmer and president of the Dalby Table Tennis Club. ""It helps you forget about things for a while, and you can take your frustrations out on a little table tennis ball!""",Copyright: AAP | Source: ABC Southern Qld | Byline: Peter Gunders,"Community and Society, Lifestyle and Leisure, Rural, Sport",ABC Southern Queensland,QLD,Dalby,table tennis stress drought ping pong dalby,-27.1833,151.261,http://www.abc.net.au/local/photos/2014/08/14/4066999-mediarss.xml, A Dalby farmer says picking up a table tennis bat has helped him de-stress It good fun said Mr Bremner You concentrate on hitting the ball so you can't worry about anything else that happening around you It an easy sport to play and there not much risk of injury and one of those sports where you don't have to worry about the weather,"images/0385.png"
Meet Tamboﾒs new chief teddy bear maker,http://www.abc.net.au/local/photos/2014/07/30/4057155.htm,30/07/2014,http://www.abc.net.au/reslib/201407/r1309823_18011298.JPG,"Verna Kruckow making a large chocolate brown teddy bear in Tambo. When completed, the bear will be similar to the one given to Prince George.",Copyright: ABC | Source: ABC | Byline: Blythe Moore,"Business, Economics and Finance:Small Business, Disasters and Accidents:Drought, Human Interest:People,",ABC Western Queensland,QLD,Tambo,"tambo teddies, verna kruckow, price george, gift, queensland government, princess mary, denmark, chief sewer, mary sutherland, drought, tambo, abc western queensland, blythe moore, alison shaw, tammy eckel, kiralee fox, ash moore",-24.8843,146.2559,http://www.abc.net.au/local/photos/2014/07/30/4057155-mediarss.xml, Verna Kruckow has made thousands of teddy bears in the last 11 years - one of them was even given as a gift to Prince George As the chief sewer for iconic local business Tambo Teddies keeping her hands in good condition is vitally important It is very hard on your hands holding the skins together she said But it worth it at the end of it to see the finished product Verna has worked for Tambo Teddies since she and her family arrived in the outback town 11 years ago Since the sale of the business and retirement of founding owner Mary Sutherland four months ago Ms Kruckow has stepped up to the chief sewer role She now makes the bulk of the business teddy bears which end up all over the world I can say I made the one for Prince George other than that they're just everywhere she said You name a place and we could say we've sent one there it pretty interesting The Queensland Government gave a Tambo Teddy to the Duke and Duchess of Cambridge for Prince George during the royal visit earlier this year A teddy was also sent to Princess Mary of Denmark from the Queensland National Party following the birth of her son in 2005 New owner Alison Shaw who purchased the business with fellow local women Tammy Eckel and Kiralee Fox says they plan to continue pushing their bears into the overseas market Definitely we want to expand and get our bears everywhere but of course we have to strengthen supply first we have to pace it with what we can supply she said To overcome supply issues new sewers are being trained We hope to grow it so much more to employ more people so it only beneficial for the region she said The business was originally established in 1992 to help the town survive drought and a downturn in the wool industry Alison says the current drought did not deter her and her business partners from taking on the operation I don't think that this is really a business that being impacted by drought it more tourism and it about getting it out there further she said,"images/0429.png"
Queensland job seekers on frontline in fight against weeds,http://www.abc.net.au/local/photos/2014/07/28/4055303.htm,28/07/2014,http://www.abc.net.au/reslib/201407/r1308665_17983008.JPG,Former national bronco riding champion Ray Hermann is participating in a new program to get job seekers ready for work in outback Queensland.,Copyright: ABC | Source: ABC | Byline: Blythe Moore,"Community and Society:Unemployment, Disasters and Accidents:Drought, Rural:Weeds,",ABC Western Queensland,QLD,Longreach,"ray hermann, tony rayner, rapad employment services queensland, national bronco riding champion, weed and drought program, woody weeds, unemployment, job seeker, rural, property work, remote jobs program, longreach, winton, longreach agricultural program, federal government, ash moore, blythe moore, abc western queensland",-23.1445,144.0475,http://www.abc.net.au/local/photos/2014/07/28/4055303-mediarss.xml, Dozens of job seekers in western Queensland are learning skills of the land as part of a Federal Government program to get them ready for work in the outback He been a kangaroo shooter a fencer a ringer and a rodeo rider He considered a legend on the bronco riding circuit claiming several national titles in the 1980s Despite all his experience Mr Hermann has struggled with securing permanent work in recent years I'm a bit broke down he said I've had seven broken arms and no one wants to employ you much when you can't do the job properly He is currently taking part in a new weed and drought program run by the Remote Area Planning and Development Board (RAPAD) Employment Services Queensland in a bid to secure employment The program teaches job seekers the logistics of using chemicals on weeds and each participant finishes the course with qualifications in weed reduction Tony Rayner from RAPAD Employment Services Queensland says the idea is to give job seekers skills with real life value He says there are genuine opportunities for employment in weed mitigation in western Queensland One of biggest challenges for western Queensland at the moment other than the crippling drought that we have is the economic and environment impact of woody weeds he said A number of agencies are already fighting these weeds but they certainly need assistance and this weed and drought program is one where we can assist with that As part of the two-week course job seekers spend between two and five days spraying weeds on local properties There are not many areas that don't have a weed issue and those that do appreciate having willing hands on the property for a few days to give them a bit of assistance Mr Rayner said Mr Hermann says the program has been a great motivation for him and other job seekers When you're sitting around doing nothing for so long you really need something like this to get you motivated and when you get motivated like this you start looking for work more he said The new weed and drought program is part of the Federal Government Remote Jobs Program which was launched in July last year,"images/0436.png"
Drought-stricken Birdsville gets a haircut,http://www.abc.net.au/local/photos/2014/07/22/4051228.htm,22/07/2014,http://www.abc.net.au/reslib/201407/r1306009_17918681.jpg,Longreach hairdressers Kira Weese and Sophie Peacock took their scissors on the road to help Birdsville locals.,Copyright: ABC | Source: ABC | Byline: Blythe Moore,"Community and Society, Disasters and Accidents:Drought, Human Interest:People,",ABC Western Queensland,QLD,Birdsville,"birdsville, longreach, haircut, hairdresser, hair, drought, adria downs, rhonda heslin, blythe moore, sophie peacock, kira weese, abc western queensland, lydia burton, danny kennedy, abc western queensland, blythe moore",-25.9005,139.0522,http://www.abc.net.au/local/photos/2014/07/22/4051228-mediarss.xml, When times are tough on the land many women on remote properties have little chance to pamper themselves A haircut which might require travelling hundreds of kilometres would often be out of the question But a group of western Queensland hairdressers is making that small luxury a little easier for women in Birdsville They set up a makeshift salon in the laundry of the Birdsville Hotel Rhonda Heslin works as a cook at Adria Downs near Birdsville and travelled 130 kilometres to have her hair done by the Longreach hairdressers Ms Heslin says having the hairdressers in town gave locals the chance to forget their worries for a little while You just go and sit down and you chat to different ones you haven't seen for a while and you forget the drought just for that couple of hours until you drive back out again she said She says the hairdressers efforts cheered up many locals It very important to go to town and be able to wind down a little bit I think so we really appreciate anyone who takes the time out to make the effort to come down to Birdsville she said Hairdresser Sophie Peacock says she and her colleagues wanted to do something nice for Birdsville women during the drought It very hard for them to get up here (to Longreach) just to have a hair appointment most of them try and schedule it in when they're doing other jobs and it a very rushed trip for them Mrs Peacock says a simple haircut can make a big difference to an average day Even just having your hair done can brighten it up 100 per cent and people out there who don't get away as often you couldn't give them a better treat really she said,"images/0455.png"
A dirty game,http://www.abc.net.au/local/photos/2014/06/29/4035519.htm,29/06/2014,http://www.abc.net.au/reslib/201406/r1296159_17685719.JPG,The Queensland Womenﾒs Sand Green Championship has been hosted by the Winton Golf Club for the first time since 2002. Golfing Queenslandﾒs Chris Evans says Winton is one of the most remote locations where the competition is held.,Copyright: ABC | Source: ABC | Byline: Blythe Moore,"Rural:Rural Tourism, Sport:Golf,",ABC Western Queensland,QLD,Winton,"2014 women's sand golf championships, winton, robyn stephens, merle vandersee, golf queensland, chris evans, course condition, drought, dry, rain, blythe moore, danny kennedy, abc western queensland",-22.1826,142.9414,http://www.abc.net.au/local/photos/2014/06/29/4035519-mediarss.xml, Trekking across a dirt course and teeing off on black sand might not be every golfer idea of a great game but competitors in the Queensland Women Sand Green Championship seemed to have the time of their lives in Winton over the weekend Many travelled hundreds of kilometres for the event which moves location each year Merle Vandersee from Burrum Heads in the Wide Bay district says she has never missed the competition since it began 27 years ago I'm not a champion golfer I come for the fun she said If you have a good round then that a bonus! Mrs Vandersee says playing on sand greens is a lot dirtier than grass but she loves it I did learn to play golf at Clermont on sand this is my once a year go at sands and I'm not going to miss it until I'm incapable of getting here she said Winton Golf Club secretary Robyn Stephens says the women have been having a ball in the outback The camaraderie just been unbelievable with all the ladies she said A lot of them not only come and stay in the accommodation they've brought their own vans and they're going to do the touristy thing which is really great for the outback She says because of the drought it has taken months of work to bring the course up to standard Golf Queensland operations manager Chris Evans says the competitors have been very supportive of the conditions at Winton They understand that the club hasn't received rain and as far as the sand greens are concerned the ladies are very happy at the consistency of the sand he said The ladies have just as much fun as the men do if not more so They're very supportive of each other and they keep commenting they're all here just to have a great time The men competition was held in Hughenden in early June,"images/0525.png"
Newlyweds take on wide open land of Lake Nash Station,http://www.abc.net.au/local/photos/2014/06/24/4031954.htm,24/06/2014,http://www.abc.net.au/reslib/201406/r1293856_17632743.JPG,"Fred and Sarah Hughes at sunrise on Lake Nash Station, on the Queensland-Northern Territory border. The newlyweds moved to Lake Nash Station two years ago, and took over the management of the large property in August 2013. ""Itﾒs almost its own country,"" Fred said. In fact, Lake Nash Station is bigger than Northern Ireland.",Copyright: ABC | Source: ABC | Byline: Blythe Moore,"Disasters and Accidents:Drought, Human Interest:People, Rural:Livestock:Beef Cattle,",ABC North West Qld,QLD,Mount Isa,"lake nash station, cattle, fred hughes, sarah hughes, john costello, alpurrulam, indigenous, aboriginal community, abc western queensland, abc north west queensland, mount isa, drought, abc rural, rural report, virginia tapp",-20.2287,139.1897,http://www.abc.net.au/local/photos/2014/06/24/4031954-mediarss.xml, It hard enough running a 17 million hectare cattle property when the going is good but it a hugely difficult task in the middle of a devastating drought It not a lifestyle that would appeal to every young person but newlyweds Fred and Sarah Hughes have grabbed the opportunity with both hands Sarah is already on the computer answering emails while Fred is getting ready to fly out of Lake Nash Station for a one-day course With such busy lives pinning them down for an early-morning interview isn't easy But like many country blokes Fred is good to his word Alright let do this he said hurrying into the office and pulling up a chair next to his wife I start with the question that been on my mind since I arrived at Lake Nash Station When you took over the management of the property did you know what you were getting yourselves into? Sarah firmly shakes her head while Fred offers a wry chuckle We took over in August last year it was in the middle of a terrible drought It was a very terrible time to take over he said After going through something like that we've certainly found this year a hell of a lot easier than last year and it been a wonderful experience The property was originally settled more than 100 years ago by Irish immigrant John Costello and has been in Fred family for about a decade He says he feels a big weight of responsibility managing such a large station with a long history and 20 staff When you've got a station of this size and so many staff and so many people have a connection here we're always very mindful of upholding the standards he said A lot of jackaroos come through here for a couple of years These are their formative years then they go on to bigger and better things whether it in the beef industry of wherever You want to impress the values of hard work and commitment and really taking pride in their work Fred and Sarah say their next goal is to turn the cattle operation organic They're currently one year into the three-year process It a market that been growing and growing strongly for a long time and it really well-suited to this western country where there no ticks and no flies no parasites Fred said Wherever it dry it makes organics easy As for whether they're at Lake Nash for the long haul? We think so we love it out here and we're just enjoying the many challenges and rewards of life in the bush Sarah said,"images/0539.png"
Unsuspecting drover,http://www.abc.net.au/local/photos/2014/06/23/4031277.htm,23/06/2014,http://www.abc.net.au/reslib/201406/r1293391_17622066.jpg,"When Alice Mabin heard about 18,000 head of cattle being moved from western Queensland to New South Wales, she never could have guessed she would become part of the story.",Copyright: ABC | Source: Contributed | Byline:,"Arts and Entertainment:Photography, Human Interest:People, Rural:Livestock:Beef Cattle,",ABC Western Queensland,QLD,Longreach,"cattle drive, drove, the drover, book, photography, cows, drought, alice mabin, bill little, theo parry, longreach, winton, hay, nsw, qld, new south wales, queensland, rural, 18000 head, abc western queensland, belinda sanders, paula tappiolas, abc southern queensland, abc north queensland",-23.6445,144.4475,http://www.abc.net.au/local/photos/2014/06/23/4031277-mediarss.xml, How a photographer with no experience on a stock route joined one of the biggest droving expeditions in Australian recent history She had just resigned from her job in Roma southern Queensland and was taking time to chill out when she heard about a large cattle drive from Queensland to Hay in New South Wales South Australian pastoralist Tom Brinkworth had purchased 18000 head of cattle from the Australian Agricultural Company and was walking them down south in mobs of 2000 Ms Mabin was intrigued She tracked down the number for the boss drover Bill Little and asked if she could join his mob for a day I didn't come prepared for it I wasn't dressed appropriately she said I had a short-sleeve shirt on I didn't have a hat and it was blaring sun and hot Mr Little handed Ms Mabin a hat and a long-sleeved shirt and before she knew it she was on horseback For the next five months Ms Mabin joined the drove off and on always with her camera in hand Some of the things you got to see were just fantastic people think it romantic but it ain't she said It tough it not for the faint-hearted There are some pretty hard core days with the heat and the dust If my camera gear had feelings it'd probably kill me because it looked terrible by the end of it! Ms Mabin has just published The Drover - a book of her photographs from the cattle drive Ninety per cent of the images were taken on horseback She says it was difficult to say goodbye when her time with the drove came to an end It was sad to say turn around and say goodbye to the cattle she said I was so used to seeing the arse-end of those cows,"images/0540.png"
No horsing around in this outback Qld classroom,http://www.abc.net.au/local/photos/2014/06/20/4029778.htm,20/06/2014,http://www.abc.net.au/reslib/201406/r1292362_17600534.JPG,Students at the presentation ceremony after finishing their horsemanship challenge at the Longreach Agricultural College.,Copyright: ABC | Source: ABC | Byline: Blythe Moore,"Education, Rural:Rural Youth,",ABC Western Queensland,QLD,Longreach,"longreach agricultural college, longreach pastoral college, queensland country hour, craig zonca, blythe moore, rural youth, horsemanship, horse, john arnold, darren close, drought, abc western queensland",-22.9445,144.3475,http://www.abc.net.au/local/photos/2014/06/20/4029778-mediarss.xml, Breaking in a new horse can be a pretty difficult task particularly if you've never done it before That the challenge laid down for students from around Australia at the Longreach Agricultural College this semester As part of their end of term exams the students are competing against each other to see whose unbroken horse turned out the best Instead of computers and books they're using horses and a show ring to show how well they've broken in their horses this semester Student Darren Close has taken out the Colt Challenge category Mr Close from Hampton near Toowoomba says after spending months together he and his horse now have a special friendship You soon learn what he doesn't like and where he likes to get a scratch Mr Close said If he is having a bit of a bad day you just scratch him there and he like that good that good and he might change his attitude to you for the rest of the day He been really accepting of everything I have done with him I've tried to be as consistent as I can with him so he knows what I want him to do Students from all over Australia have been in western Queensland for six months to take part in the course Teacher John Arnold says some students are now going back to family operations to help their parents in the drought while others will seek work with horse trainers He says it will tougher for the students to find work now than it would have been five years ago There not a lot of spare cash around for people to be investing in competition horses or pleasure horses but at the end of the day Australia still needs people to go and muster cattle he said There still plenty of work opportunities for these guys to go working on cattle places,"images/0542.png"
Water woes,http://www.abc.net.au/local/photos/2014/05/01/3995846.htm,1/05/2014,http://www.abc.net.au/reslib/201405/r1270335_17105685.jpg,"Lake Moondarra, Mount Isa's main water supply, is just 31 per cent full.",Copyright: ABC | Source: ABC | Byline: Emily Bissland,"Environment:Water Management, Environment:Water Supply, Government and Politics:Local Government,",ABC North West Qld,QLD,Mount Isa,"lake moondarra, mount isa, water supply, water restrictions, mayor tony mcgrady, councillor, mount isa city council, drought, rain, kate stephens, news, abc north west queensland, blythe moore",-20.2287,139.5897,http://www.abc.net.au/local/photos/2014/05/01/3995846-mediarss.xml, Mount Isa residents could see their water rates rise by more than $400 next financial year Mount Isa mayor Tony McGrady says this has forced the local water board to hire water treatment equipment at a cost of more than $250000 a month Along with other administration and additional pumping costs ratepayers are facing a $4 million bill for water charges When you receive your rate notice next year this will be included and I'm giving fair warning now that just on water rates alone the people of the city will be paying an additional $440 dollars per year Councillor McGrady said Councillor McGrady says the Council will ask the Federal and State Government for financial assistance to reduce the burden on ratepayers We will simply tell them what the facts of life are and that if this city is to continue which it will but if this city continues to pay the royalties and the other costs to the State Government throughout the mining industry governments have to ensure the survival of our city Councillor McGrady says the drought is directly responsible for the algae issue Of course it drought related we have had the worst rainfall in the history of this city and whilst we've seen rain surrounding us everybody in the city knows it escaped us he said After a good wet season Lake Moondarra would usually be full by this time of year Currently it is at just 31 per cent and is decreasing by approximately 1 per cent each week Councillor McGrady says if the level goes below 20 per cent it will become difficult to pump water from Lake Moondarra He says most people in Mount Isa are doing the right thing when it comes to responsible water consumption The reality is simple we're not getting rain and nothing is going into Lake Moondarra but we're pulling out of it every second of the day,"images/0698.png"
